Gene	Earliest_Pub_Date	NumPub	Titles
ABCD3	2022	20	Tau reduction attenuates autism-like features in Fmr1 knockout mice., Unravelling the link between neurodevelopmental disorders and short tandem CGG-repeat expansions., Large-Scale Whole Genome Sequence Analysis of &gt;22,000 Subjects Provides no Evidence of <i>FMR1</i> Premutation Allele Involvement in Autism Spectrum Disorder., Cochlear Nucleus Transcriptome of a Fragile X Mouse Model Reveals Candidate Genes for Hyperacusis., Accelerated Apoptosis and Down-Regulated FMRP in Human Neuroblastoma Cells with CRISPR/<i>Cas9</i> Genome Editing., A Postmortem MRI Study of Cerebrovascular Disease and Iron Content at End-Stage of Fragile X-Associated Tremor/Ataxia Syndrome., Size matters: Fighting repeat expansion size in fragile X syndrome using antisense oligonucleotides., Dissecting the roles of EIF4G homologs reveals DAP5 as a modifier of CGG repeat-associated toxicity in a Drosophila model of FXTAS., Site-specific R-loops induce CGG repeat contraction and fragile X gene reactivation., Synthesis and cloning of long repeat sequences using single-stranded circular DNA., A sensitive and reproducible qRT-PCR assay detects physiological relevant trace levels of FMR1 mRNA in individuals with Fragile X syndrome., Neuropsychiatric feature-based subgrouping reveals neural sensory processing spectrum in female FMR1 premutation carriers: A pilot study., The mutational dynamics of short tandem repeats in large, multigenerational families., Screening for Fragile X Syndrome Among Filipino Children with Autism Spectrum Disorder., CGG repeats trigger translational frameshifts that generate aggregation-prone chimeric proteins., Identification and Monitoring of Nucleotide Repeat Expansions Using Southern Blotting in <i>Drosophila</i> Models of <i>C9orf72</i> Motor Neuron Disease and Frontotemporal Dementia., Noninvasive prenatal diagnosis of genetic diseases induced by triplet repeat expansion by linked read haplotyping and Bayesian approach., Both cis and trans-acting genetic factors drive somatic instability in female carriers of the FMR1 premutation., Triplet-Primed PCR Assays for Accurate Screening of FMR1 CGG Repeat Expansion and Genotype Verification., <i>AFF2</i> Is Associated With X-Linked Partial (Focal) Epilepsy With Antecedent Febrile Seizures.
AFF2	2014	2	Unravelling the link between neurodevelopmental disorders and short tandem CGG-repeat expansions., FRA2A is a CGG repeat expansion associated with silencing of AFF3.
AFF3	2022	20	Msi2 enhances muscle dysfunction in a myotonic dystrophy type 1 mouse model., Friedreich's ataxia: new insights., Frequency of GAA-<i>FGF14</i> Ataxia in a Large Cohort of Brazilian Patients With Unsolved Adult-Onset Cerebellar Ataxia., Proteomic Investigation of Differential Interactomes of Glypican 1 and a Putative Disease-Modifying Variant of Ataxia., Cochlear Nucleus Transcriptome of a Fragile X Mouse Model Reveals Candidate Genes for Hyperacusis., Radiological correlates of pseudobulbar affect: Corticobulbar and cerebellar components in primary lateral sclerosis., Genome-wide screening in pluripotent cells identifies Mtf1 as a suppressor of mutant huntingtin toxicity., X-linked SBMA model mice display relevant non-neurological phenotypes and their expression of mutant androgen receptor protein in motor neurons is not required for neuromuscular disease., Sequencing through hyperexpanded Friedreich's ataxia-GAA repeats by nanopore technology: implications in genotype-phenotype correlation., Differential expression of the androgen receptor gene is correlated with CAG polymorphic repeats in patients with prostate cancer., A Novel Metric for Predicting Severity of Disease Features in Friedreich's Ataxia., Unexpected frequency of the pathogenic AR CAG repeat expansion in the general population., Substitution to hydrophobic linker and formation of host-guest complex enhanced the effect of synthetic transcription factor made of pyrrole-imidazole polyamide., A new FRDA mouse model [<i>Fxn</i> <sup>null</sup>:YG8s(GAA) &gt; 800] with more than 800 GAA repeats., Bicalutamide and Trehalose Ameliorate Spinal and Bulbar Muscular Atrophy Pathology in Mice., The Genomic landscape of short tandem repeats across multiple ancestries., Neurobehavioral deficits of mice expressing a low level of G127V mutant frataxin., <i>FXN</i> gene methylation determines carrier status in Friedreich ataxia., Genetics of Ataxias in Indian Population: A Collative Insight from a Common Genetic Screening Tool., Fast and reliable detection of repeat expansions in spinocerebellar ataxia using exomes.
AR	2009	4	Clinical and genetic study of developmental and epileptic encephalopathy in Argentinean pediatric patients., Different types of disease-causing noncoding variants revealed by genomic and gene expression analyses in families with X-linked intellectual disability., <i>Arx</i> expansion mutation perturbs cortical development by augmenting apoptosis without activating innate immunity in a mouse model of X-linked infantile spasms syndrome., A triplet repeat expansion genetic mouse model of infantile spasms syndrome, Arx(GCG)10+7, with interneuronopathy, spasms in infancy, persistent seizures, and adult cognitive and behavioral impairment.
ARX	2018	20	Familial adult myoclonus epilepsy: Clinical findings, disease course, and comorbidities., Differential diagnosis of familial adult myoclonic epilepsy., Fast and reliable detection of repeat expansions in spinocerebellar ataxia using exomes., Clinical and genetic study of developmental and epileptic encephalopathy in Argentinean pediatric patients., Insights into the Genetic Profile of Two Siblings Affected by Unverricht-Lundborg Disease Using Patient-Derived hiPSCs., Whole genome sequencing for the diagnosis of neurological repeat expansion disorders in the UK: a retrospective diagnostic accuracy and prospective clinical validation study., CAG repeat-binding small molecule improves motor coordination impairment in a mouse model of Dentatorubral-pallidoluysian atrophy., Clinical and molecular characterization of Unverricht-Lundborg disease among Egyptian patients., Comprehensive genetic, clinical and electrophysiological studies of familial cortical myoclonic tremor with epilepsy 1 highlight the role of gene configurations., Clinical and genomic analysis of a large Chinese family with familial cortical myoclonic tremor with epilepsy and <i>SAMD12</i> intronic repeat expansion., DRPLA: understanding the natural history and developing biomarkers to accelerate therapeutic trials in a globally rare repeat expansion disorder., Genetic testing and the phenotype of Polish patients with Unverricht-Lundborg disease (EPM1) - A cohort study., The cerebellar white matter lesions in dentatorubral-pallidoluysian atrophy., Investigations of Huntington's Disease and Huntington's Disease-Like Syndromes in Indian Choreatic Patients., Spinocerebellar Ataxias in India: Three&#x2011;year Molecular Data from a Central Reference Laboratory., Generation of induced pluripotent stem cell line CSSi008-A (4698) from a patient affected by advanced stage of Dentato-Rubral-Pallidoluysian atrophy (DRPLA)., NHLRC1 dodecamer repeat expansion demonstrated by whole genome sequencing in a Chihuahua with Lafora disease., A study of Huntington disease-like syndromes in black South African patients reveals a single SCA2 mutation and a unique distribution of normal alleles across five repeat loci., Accumulation of Laforin and Other Related Proteins in Canine Lafora Disease With EPM2B Repeat Expansion., Teenage-onset progressive myoclonic epilepsy due to a familial <i>C9orf72</i> repeat expansion.
ATN1	2021	20	Prevalence of repeat expansions causing autosomal dominant spinocerebellar ataxias in Hokkaido, the northernmost island of Japan., Antagonistic roles of canonical and Alternative-RPA in disease-associated tandem CAG repeat instability., Widespread alternative splicing dysregulation occurs presymptomatically in CAG expansion spinocerebellar ataxias., Triplet-primed PCR and Melting Curve Analysis for Rapid Molecular Screening of Spinocerebellar Ataxia Types 1, 2, and 3., Short tandem repeat expansions in sporadic amyotrophic lateral sclerosis and frontotemporal dementia., Genetic variability in sporadic amyotrophic lateral sclerosis., Genetics of Ataxias in Indian Population: A Collative Insight from a Common Genetic Screening Tool., Fast and reliable detection of repeat expansions in spinocerebellar ataxia using exomes., Genetic landscape of ALS in Malta based on a quinquennial analysis., Spatial and Temporal Diversity of Astrocyte Phenotypes in Spinocerebellar Ataxia Type 1 Mice., ATTCT and ATTCC repeat expansions in the ATXN10 gene affect disease penetrance of spinocerebellar ataxia type 10., The S-Factor, a New Measure of Disease Severity in Spinocerebellar Ataxia: Findings and Implications., Amyotrophic lateral sclerosis and cerebellum., Home-based biofeedback speech treatment improves dysarthria in repeat-expansion SCAs., Combined overexpression of ATXN1L and mutant ATXN1 knockdown by AAV rescue motor phenotypes and gene signatures in SCA1 mice., Re-analysis of the Hungarian amyotrophic lateral sclerosis population and evaluation of novel ALS genetic risk variants., Whole genome sequencing for the diagnosis of neurological repeat expansion disorders in the UK: a retrospective diagnostic accuracy and prospective clinical validation study., Genetic Distribution of Five Spinocerebellar Ataxia Microsatellite Loci in Mexican Native American Populations and Its Impact on Contemporary Mestizo Populations., ATXN10 Is Required for Embryonic Heart Development and Maintenance of Epithelial Cell Phenotypes in the Adult Kidney and Pancreas., Macular Morpho-Functional and Visual Pathways Functional Assessment in Patients with Spinocerebellar Type 1 Ataxia with or without Neurological Signs.
ATXN1	2014	20	ATTCT and ATTCC repeat expansions in the ATXN10 gene affect disease penetrance of spinocerebellar ataxia type 10., ATXN10 Is Required for Embryonic Heart Development and Maintenance of Epithelial Cell Phenotypes in the Adult Kidney and Pancreas., Frequency of spinocerebellar ataxia mutations in patients with multiple system atrophy., Prevalence of <i>RFC1</i>-mediated spinocerebellar ataxia in a North American ataxia cohort., Minidumbbell structures formed by ATTCT pentanucleotide repeats in spinocerebellar ataxia type&#xa0;10., Pulse-Field capillary electrophoresis of repeat-primed PCR amplicons for analysis of large repeats in Spinocerebellar Ataxia Type 10., Spinocerebellar Ataxias in India: Three&#x2011;year Molecular Data from a Central Reference Laboratory., Extensive cerebellar and thalamic degeneration in spinocerebellar ataxia type 10., ATXN10 Microsatellite Distribution in a Peruvian Amerindian Population., Detailed analysis of HTT repeat elements in human blood using targeted amplification-free long-read sequencing., Olfactory Function in SCA10., Frequency of SCA8, SCA10, SCA12, SCA36, FXTAS and C9orf72 repeat expansions in SCA patients negative for the most common SCA subtypes., Parkinson's disease associated with pure <i>ATXN10</i> repeat expansion., Inheritance patterns of ATCCT repeat interruptions in spinocerebellar ataxia type 10 (SCA10) expansions., Analysis of SCA8, SCA10, SCA12, SCA17 and SCA19 in patients with unknown spinocerebellar ataxia: a Thai multicentre study., SMRT Sequencing of Long Tandem Nucleotide Repeats in SCA10 Reveals Unique Insight of Repeat Expansion Structure., Crystallographic and Computational Analyses of AUUCU Repeating RNA That Causes Spinocerebellar Ataxia Type 10 (SCA10)., Mutational screening of 320 Brazilian patients with autosomal dominant spinocerebellar ataxia., Repeat interruptions in spinocerebellar ataxia type 10 expansions are strongly associated with epileptic seizures., Evaluating noncoding nucleotide repeat expansions in amyotrophic lateral sclerosis.
ATXN10	2022	20	The Frequency of Intermediate Alleles in Patients with Cerebellar Phenotypes., Prevalence of repeat expansions causing autosomal dominant spinocerebellar ataxias in Hokkaido, the northernmost island of Japan., Development of an isogenic human cell trio that models polyglutamine disease., Triplet-primed PCR and Melting Curve Analysis for Rapid Molecular Screening of Spinocerebellar Ataxia Types 1, 2, and 3., Genetic screening for Huntington disease phenocopies in Sweden: A tertiary center case series focused on short tandem repeat (STR) disorders., Association of Copresence of Pathogenic Variants Related to Amyotrophic Lateral Sclerosis and Prognosis., Short tandem repeat expansions in sporadic amyotrophic lateral sclerosis and frontotemporal dementia., Detection of <i>ATXN2</i> Expansions in an Exome Dataset: An Underdiagnosed Cause of Parkinsonism., Genetic variability in sporadic amyotrophic lateral sclerosis., TR-FRET-Based Immunoassay to Measure Ataxin-2 as a Target Engagement Marker in Spinocerebellar Ataxia Type 2., Genetics of Ataxias in Indian Population: A Collative Insight from a Common Genetic Screening Tool., Moyamoya associated with Turner syndrome in a patient with type 2 spinocerebellar ataxia-Occam's razor or Hickam's dictum: a case report., Exploring the phenotype of Italian patients with ALS with intermediate <i>ATXN2</i> polyQ repeats., The S-Factor, a New Measure of Disease Severity in Spinocerebellar Ataxia: Findings and Implications., Amyotrophic lateral sclerosis and cerebellum., A quantitative high-throughput screen identifies compounds that lower expression of the SCA2-and ALS-associated gene ATXN2., The Clinical and Polynucleotide Repeat Expansion Analysis of <i>ATXN2, NOP56, AR</i> and <i>C9orf72</i> in Patients With ALS From Mainland China., Re-analysis of the Hungarian amyotrophic lateral sclerosis population and evaluation of novel ALS genetic risk variants., Genetic spectrum in a cohort of patients with distal hereditary motor neuropathy., Whole genome sequencing for the diagnosis of neurological repeat expansion disorders in the UK: a retrospective diagnostic accuracy and prospective clinical validation study.
ATXN2	2022	20	Establishment of human-induced pluripotent stem cell GZHMCi0011-A from peripheral blood mononuclear cells from a volunteer with 14/63 CAG repeats of the ATXN3 mutation., Prevalence of repeat expansions causing autosomal dominant spinocerebellar ataxias in Hokkaido, the northernmost island of Japan., Mitochondrial Dysfunction and Decreased Cytochrome <i>c</i> in Cell and Animal Models of Machado-Joseph Disease., Frequency of GAA-<i>FGF14</i> Ataxia in a Large Cohort of Brazilian Patients With Unsolved Adult-Onset Cerebellar Ataxia., Intronic <i>FGF14</i> GAA repeat expansions are a common cause of ataxia syndromes with neuropathy and bilateral vestibulopathy., Triplet-primed PCR and Melting Curve Analysis for Rapid Molecular Screening of Spinocerebellar Ataxia Types 1, 2, and 3., Genetic screening for Huntington disease phenocopies in Sweden: A tertiary center case series focused on short tandem repeat (STR) disorders., Regional and age-dependent changes in ubiquitination in cellular and mouse models of spinocerebellar ataxia type 3., Whole genome sequencing vs chromosomal microarray analysis in prenatal diagnosis., Disease-associated oligodendrocyte signatures are spatiotemporally dysregulated in spinocerebellar ataxia type 3., Ubiquitin-binding site 1 of pathogenic ataxin-3 regulates its toxicity in <i>Drosophila</i> models of Spinocerebellar Ataxia Type 3., Genetics of Ataxias in Indian Population: A Collative Insight from a Common Genetic Screening Tool., Deep Intronic <i>FGF14</i> GAA Repeat Expansion in Late-Onset Cerebellar Ataxia., Integrative transcriptomic analysis of the amyotrophic lateral sclerosis spinal cord implicates glial activation and suggests new risk genes., Cerebello-cerebral resting-state functional connectivity in spinocerebellar ataxia type 3., The S-Factor, a New Measure of Disease Severity in Spinocerebellar Ataxia: Findings and Implications., Derivation of spinocerebellar ataxia type 3 human embryonic stem cell line UMICHe001-A/UM134-1., Transcription factor EB-mediated mesenchymal stem cell therapy induces autophagy and alleviates spinocerebellar ataxia type 3 defects in neuronal cells model., <i>Drosophila</i> as a Model of Unconventional Translation in Spinocerebellar Ataxia Type 3., Exome sequencing of individuals with Huntington's disease implicates FAN1 nuclease activity in slowing CAG expansion and disease onset.
ATXN3	2023	20	Establishment of human-induced pluripotent stem cell GZHMCi0011-A from peripheral blood mononuclear cells from a volunteer with 14/63 CAG repeats of the ATXN3 mutation., Prevalence of repeat expansions causing autosomal dominant spinocerebellar ataxias in Hokkaido, the northernmost island of Japan., Mitochondrial Dysfunction and Decreased Cytochrome <i>c</i> in Cell and Animal Models of Machado-Joseph Disease., Antagonistic roles of canonical and Alternative-RPA in disease-associated tandem CAG repeat instability., Development of an isogenic human cell trio that models polyglutamine disease., Repeat expansions in <i>NOP56</i> are a cause of spinocerebellar ataxia Type 36 in the British population., Widespread alternative splicing dysregulation occurs presymptomatically in CAG expansion spinocerebellar ataxias., The molecular mechanisms of spinocerebellar ataxias for DNA repeat expansion in disease., Frequency and phenotypic spectrum of spinocerebellar ataxia 27B and other genetic ataxias in a Spanish cohort of late-onset cerebellar ataxia., The genetic and clinical spectrum in a cohort of 39 families with complex inherited peripheral neuropathies., Extreme phenotypic heterogeneity in non-expansion spinocerebellar ataxias., First families with spinocerebellar ataxia type 7 in Poland., GAA-FGF14 ataxia (SCA27B): phenotypic profile, natural history progression and 4-aminopyridine treatment response., CAG Repeat Expansion in THAP11 Is Associated with a Novel Spinocerebellar Ataxia., Short tandem repeat expansions in sporadic amyotrophic lateral sclerosis and frontotemporal dementia., A Chinese SCA36 pedigree analysis of <i>NOP56</i> expansion region based on long-read sequencing., Pentanucleotide repeat-related disorders: Genetics and bioinformatic discovery and detection., TR-FRET-Based Immunoassay to Measure Ataxin-2 as a Target Engagement Marker in Spinocerebellar Ataxia Type 2., Neuropathology of spinocerebellar ataxia type 8: Common features and unique tauopathy., Repeat-associated non-AUG translation induces cytoplasmic aggregation of CAG repeat-containing RNAs.
ATXN7	2010	20	The Frequency of Intermediate Alleles in Patients with Cerebellar Phenotypes., Prevalence of repeat expansions causing autosomal dominant spinocerebellar ataxias in Hokkaido, the northernmost island of Japan., Short tandem repeat expansions in sporadic amyotrophic lateral sclerosis and frontotemporal dementia., Neuropathology of spinocerebellar ataxia type 8: Common features and unique tauopathy., CCG&#x2022;CGG interruptions in high-penetrance SCA8 families increase RAN translation and protein toxicity., Genome sequencing identifies rare tandem repeat expansions and copy number variants in Lennox-Gastaut syndrome., Genome sequencing broadens the range of contributing variants with clinical implications in schizophrenia., Frequency of spinocerebellar ataxia mutations in patients with multiple system atrophy., Genetic and clinical analyses of spinocerebellar ataxia type 8 in mainland China., Noncoding repeat expansions for ALS in Japan are associated with the <i>ATXN8OS</i> gene., PSP-Phenotype in SCA8: Case Report and Systemic Review., Frequency of SCA8, SCA10, SCA12, SCA36, FXTAS and C9orf72 repeat expansions in SCA patients negative for the most common SCA subtypes., Sequence configuration of spinocerebellar ataxia type 8 repeat expansions in a Japanese cohort of 797 ataxia subjects., Analysis of a fully penetrant spinocerebellar ataxia type 8 Brazilian family., Compound heterozygous intermediate MJD alleles cause cerebellar ataxia with sensory neuropathy., Analysis of SCA8, SCA10, SCA12, SCA17 and SCA19 in patients with unknown spinocerebellar ataxia: a Thai multicentre study., Mutational screening of 320 Brazilian patients with autosomal dominant spinocerebellar ataxia., Investigation of SCA10 in the Cypriot population: further exclusion of SCA dynamic repeat mutations., Detection of large expansions in SCA8 using a fluorescent repeat-primed PCR assay., Coexisting huntingtin and SCA8 repeat expansion: case report of a severe complex neurodegenerative syndrome.
ATXN8OS	2014	9	Prevalence of repeat expansions causing autosomal dominant spinocerebellar ataxias in Hokkaido, the northernmost island of Japan., Synthesis and cloning of long repeat sequences using single-stranded circular DNA., ATTCT and ATTCC repeat expansions in the ATXN10 gene affect disease penetrance of spinocerebellar ataxia type 10., Midbrain atrophy related to parkinsonism in a non-coding repeat expansion disorder: five cases of spinocerebellar ataxia type 31 with nigrostriatal dopaminergic dysfunction., Small molecule targeting r(UGGAA)<sub>n</sub> disrupts RNA foci and alleviates disease phenotype in Drosophila model., Long-read sequencing identifies the pathogenic nucleotide repeat expansion in RFC1 in a Japanese case of CANVAS., Sequence configuration of spinocerebellar ataxia type 8 repeat expansions in a Japanese cohort of 797 ataxia subjects., Regulatory Role of RNA Chaperone TDP-43 for RNA Misfolding and Repeat-Associated Translation in SCA31., Rapid detection of expanded short tandem repeats in personal genomics using hybrid sequencing.
BEAN1	2023	20	Unveiling the SOD1-mediated ALS phenotype: insights from a comprehensive meta-analysis., Glycine-Alanine Dipeptide Repeat Protein from C9-ALS Interacts with Sulfide Quinone Oxidoreductase (SQOR) to Induce the Activity of the NLRP3 Inflammasome in HMC3 Microglia: Irisflorentin Reverses This Interaction., Roadmap for C9ORF72 in Frontotemporal Dementia and Amyotrophic Lateral Sclerosis: Report on the C9ORF72 FTD/ALS Summit., Senataxin helicase, the causal gene defect in ALS4, is a significant modifier of C9orf72 ALS G4C2 and arginine-containing dipeptide repeat toxicity., C9orf72 Repeat Expansion Initially Presenting as Late-onset Bipolar Disorder With Psychosis., Temporal course of cognitive and behavioural changes in motor neuron diseases., Amyotrophic Lateral Sclerosis: From Mechanisms to Current, Emerging, and Alternative Therapeutics., C9orf72-ALS human iPSC microglia are pro-inflammatory and toxic to co-cultured motor neurons via MMP9., Divergent single cell transcriptome and epigenome alterations in ALS and FTD patients with C9orf72 mutation., Insight into Tetramolecular DNA G-Quadruplexes Associated with ALS and FTLD: Cation Interactions and Formation of Higher-Ordered Structure., Familial motor neuron disease: co-occurrence of PLS and ALS (-FTD)., Translation of dipeptide repeat proteins in <i>C9ORF72</i> ALS/FTD through unique and redundant AUG initiation codons., Pearls &amp; Oy-sters: Familial Verbal Auditory Agnosia Due to C9orf72 Repeat Expansion., The C9ORF72 repeat expansion alters neurodevelopment., Psychopharmacological Medication Use in Frontotemporal Dementia at the Time of Diagnosis: Comparison with Alzheimer's Disease., Genetic and Neuroimaging Analysis of SIGMAR1 for Frontotemporal Dementia., Repeated mild traumatic brain injury triggers pathology in asymptomatic C9ORF72 transgenic mice., No Association of Multiple Sclerosis with <i>C9orf72</i> Hexanucleotide Repeat Size in an Austrian Cohort., FUS regulates RAN translation through modulating the G-quadruplex structure of GGGGCC repeat RNA in <i>C9orf72</i>-linked ALS/FTD., Distinct neuroinflammatory signatures exist across genetic and sporadic amyotrophic lateral sclerosis cohorts.
