Gene	Earliest_Pub_Date	NumPub	Titles
HTT	2001	20	Genetic screening for Huntington disease phenocopies in Sweden: A tertiary center case series focused on short tandem repeat (STR) disorders., Clinical and Molecular Findings of Intermediate Allele Carriers in the HTT Gene from the Mexican Mestizo Population., Allelic and phenotypic heterogeneity in Junctophillin-3 related neurodevelopmental and movement disorders., The Neuropsychiatry of Huntington Disease-Like 2: A Comparison with Huntington's Disease., Investigations of Huntington's Disease and Huntington's Disease-Like Syndromes in Indian Choreatic Patients., A study of Huntington disease-like syndromes in black South African patients reveals a single SCA2 mutation and a unique distribution of normal alleles across five repeat loci., Expanding the Spectrum of Genes Involved in Huntington Disease Using a Combined Clinical and Genetic Approach., A Drosophila model of Huntington disease-like 2 exhibits nuclear toxicity and distinct pathogenic mechanisms from Huntington disease., Junctophilin 3 (JPH3) expansion mutations causing Huntington disease like 2 (HDL2) are common in South African patients with African ancestry and a Huntington disease phenotype., Evaluating noncoding nucleotide repeat expansions in amyotrophic lateral sclerosis., JPH3 repeat expansions cause a progressive akinetic-rigid syndrome with severe dementia and putaminal rim in a five-generation African-American family., Loss of junctophilin-3 contributes to Huntington disease-like 2 pathogenesis., An antisense CAG repeat transcript at JPH3 locus mediates expanded polyglutamine protein toxicity in Huntington's disease-like 2 mice., Exclusion of mutations in the PRNP, JPH3, TBP, ATN1, CREBBP, POU3F2 and FTL genes as a cause of disease in Portuguese patients with a Huntington-like phenotype., Yugoslav HD phenocopies analyzed on the presence of mutations in PrP, ferritin, and Jp-3 genes., Huntington's Disease-like 2 (HDL2) in North America and Japan., Huntington's disease--like 2 can present as chorea-acanthocytosis., Huntington's disease-like phenotype due to trinucleotide repeat expansions in the TBP and JPH3 genes., Motor discoordination in mutant mice lacking junctophilin type 3., A repeat expansion in the gene encoding junctophilin-3 is associated with Huntington disease-like 2.
JPH3	2016	14	Non-coding CGG repeat expansion in <i>LOC642361/NUTM2B-AS1</i> is associated with a phenotype of oculopharyngodistal myopathy., A large pedigree study confirmed the CGG repeat expansion of RILPL1 Is associated with oculopharyngodistal myopathy., CGG repeat expansion in LRP12 in amyotrophic lateral sclerosis., Expanded clinical spectrum of oculopharyngodistal myopathy type 1., GGC Repeat Expansion of RILPL1 is Associated with Oculopharyngodistal Myopathy., Oculopharyngodistal myopathy with CGG repeat expansions in GIPC1: the first report from southwestern China., GIPC1 CGG Repeat Expansion Is Associated with Movement Disorders., The CGG repeat expansion in RILPL1 is associated with oculopharyngodistal myopathy type 4., Intranuclear inclusions in skin biopsies are not limited to neuronal intranuclear inclusion disease but can also be seen in oculopharyngodistal myopathy., The GGC repeat expansion in NOTCH2NLC is associated with oculopharyngodistal myopathy type 3., 5' UTR CGG repeat expansion in GIPC1 is associated with oculopharyngodistal myopathy., CGG expansion in NOTCH2NLC is associated with oculopharyngodistal myopathy with neurological manifestations., Noncoding CGG repeat expansions in neuronal intranuclear inclusion disease, oculopharyngodistal myopathy and an overlapping disease., MLVA and MLST typing of Brucella from Qinghai, China.
LRP12	1998	13	Genetic variability in sporadic amyotrophic lateral sclerosis., Amyotrophic lateral sclerosis and cerebellum., Repeats expansions in <i>ATXN2</i>, <i>NOP56, NIPA1</i> and <i>ATXN1</i> are not associated with ALS in Africans., Genetic analysis of ALS cases in the isolated island population of Malta., <i>ATXN1</i> repeat expansions confer risk for amyotrophic lateral sclerosis and contribute to TDP-43 mislocalization., Analysis of the GCG repeat length in NIPA1 gene in C9orf72-mediated ALS in a large Italian ALS cohort., Association of NIPA1 repeat expansions with amyotrophic lateral sclerosis in a large international cohort., Large-scale screening in sporadic amyotrophic lateral sclerosis identifies genetic modifiers in C9orf72 repeat carriers., Ataxin-2 as potential disease modifier in C9ORF72 expansion carriers., NIPA1 polyalanine repeat expansions are associated with amyotrophic lateral sclerosis., Spastic paraplegia, ataxia, mental retardation (SPAR): a novel genetic disorder., Isolation of CAG/CTG repeats from within the chromosome 2p21-p24 locus for autosomal dominant spastic paraplegia (SPG4) by YAC fragmentation., CAG repeat expansion in autosomal dominant familial spastic paraparesis: novel expansion in a subset of patients.
NIPA1	2014	20	Repeat expansions in <i>NOP56</i> are a cause of spinocerebellar ataxia Type 36 in the British population., A Chinese SCA36 pedigree analysis of <i>NOP56</i> expansion region based on long-read sequencing., Fast and reliable detection of repeat expansions in spinocerebellar ataxia using exomes., The Clinical and Polynucleotide Repeat Expansion Analysis of <i>ATXN2, NOP56, AR</i> and <i>C9orf72</i> in Patients With ALS From Mainland China., NMR solution structures of d(GGCCTG)<sub>n</sub> repeats associated with spinocerebellar ataxia type 36., Repeats expansions in <i>ATXN2</i>, <i>NOP56, NIPA1</i> and <i>ATXN1</i> are not associated with ALS in Africans., Porphyrins ameliorate spinocerebellar ataxia type 36 GGCCTG repeat expansion-mediated cytotoxicity., Identification of GGC repeat expansion in the <i>NOTCH2NLC</i> gene in amyotrophic lateral sclerosis., Rapid Diagnosis of Spinocerebellar Ataxia 36 in a Three-Generation Family Using Short-Read Whole-Genome Sequencing Data., Hexanucleotide Repeat Expansions in c9FTD/ALS and SCA36 Confer Selective Patterns of Neurodegeneration In&#xa0;Vivo., Cerebellar Cognitive Affective Syndrome in Costa da Morte Ataxia (SCA36)., Suppression of the yeast elongation factor Spt4 ortholog reduces expanded SCA36 GGCCUG repeat aggregation and cytotoxicity., Noncoding repeat expansions for ALS in Japan are associated with the <i>ATXN8OS</i> gene., Frequency of SCA8, SCA10, SCA12, SCA36, FXTAS and C9orf72 repeat expansions in SCA patients negative for the most common SCA subtypes., Antisense Oligonucleotides Reduce RNA Foci in Spinocerebellar Ataxia 36 Patient iPSCs., Prevalence of spinocerebellar ataxia 36 in a US population., Spinocerebellar ataxia type 36 in the Han Chinese., Spinocerebellar ataxia type 36 exists in diverse populations and can be caused by a short hexanucleotide GGCCTG repeat expansion., Characteristic RNA foci of the abnormal hexanucleotide GGCCUG repeat expansion in spinocerebellar ataxia type 36 (Asidan)., Evaluating noncoding nucleotide repeat expansions in amyotrophic lateral sclerosis.
NOP56	2022	20	Non-coding CGG repeat expansion in <i>LOC642361/NUTM2B-AS1</i> is associated with a phenotype of oculopharyngodistal myopathy., A large pedigree study confirmed the CGG repeat expansion of RILPL1 Is associated with oculopharyngodistal myopathy., Utility of labial salivary gland biopsy in the histological diagnosis of neuronal intranuclear inclusion disease., Expression of expanded GGC repeats within NOTCH2NLC causes cardiac dysfunction in mouse models., Heterogenous Genetic, Clinical, and Imaging Features in Patients with Neuronal Intranuclear Inclusion Disease Carrying <i>NOTCH2NLC</i> Repeat Expansion., The genetic and clinical spectrum in a cohort of 39 families with complex inherited peripheral neuropathies., First case of adult onset neuronal intranuclear inclusion disease with both typical radiological signs and NOTCH2NLC repeat expansions in a Caucasian individual., Genetic spectrum and clinical features&#xa0;of adult leukoencephalopathies in a Chinese cohort., A comprehensive study of clinicopathological and genetic features of neuronal intranuclear inclusion disease., NOTCH2NLC GGC repeat expansion causes retinal pathology with intranuclear inclusions throughout the retina and causes visual impairment., Clinical Features and Classification of Neuronal Intranuclear Inclusion Disease., Clinical, radiological, and molecular analyses of neuronal intranuclear inclusion disease with polyglycine inclusions., Clinical phenotypic diversity of <i>NOTCH2NLC</i>-related disease in the largest case series of inherited peripheral neuropathy in Japan., <i>NOTCH2NLC</i> GGC Repeat Expansion in Patients With Vascular Leukoencephalopathy., GGC repeat expansion in NOTCH2NLC induces dysfunction in ribosome biogenesis and translation., Autonomic dysfunction-dominant phenotype in a Chinese family with biallelic GGC repeat expansions in NOTCH2NLC., Neuronal intranuclear inclusion disease mimicking progressive supranuclear palsy., Intermediate-Length GGC Repeat Expansion in NOTCH2NLC Was Identified in Chinese Patients with Amyotrophic Lateral Sclerosis., Proteomic profile of nuclei containing p62-positive inclusions in a patient with neuronal intranuclear inclusion disease., Unraveling rare form of adult-onset NIID by characteristic brain MRI features: A single-center retrospective review.
NOTCH2NLC	2022	1	GIPC1 CGG Repeat Expansion Is Associated with Movement Disorders.
NUTM2B-AS1	2001	20	Destabilizing Effect of Organo Ru(II) Salts on the Intermolecular Parallel CGG Repeat DNA Quadruplex Associated with Neurodegenerative/Neuromuscular Diseases., Oculopharyngeal muscular dystrophy mutations link the RNA-binding protein HNRNPQ to autophagosome biogenesis., Frequency and type of cancers in myotonic dystrophy: A retrospective cross-sectional study., Intranuclear inclusions in skin biopsies are not limited to neuronal intranuclear inclusion disease but can also be seen in oculopharyngodistal myopathy., Established PABPN1 intranuclear inclusions in OPMD muscle can be efficiently reversed by AAV-mediated knockdown and replacement of mutant expanded PABPN1., Diagnostics of short tandem repeat expansion variants using massively parallel sequencing and componential tools., PABPN1 gene therapy for oculopharyngeal muscular dystrophy., A decline in PABPN1 induces progressive muscle weakness in oculopharyngeal muscle dystrophy and in muscle aging., Mutation and haplotype analysis of oculopharyngeal muscular dystrophy in Thai patients., Study of a Taiwanese family with oculopharyngeal muscular dystrophy., Identification of a novel mutation in a Korean patient with oculopharyngeal muscular dystrophy., Oculopharyngeal muscular dystrophy: a point mutation which mimics the effect of the PABPN1 gene triplet repeat expansion mutation., A Drosophila model of oculopharyngeal muscular dystrophy reveals intrinsic toxicity of PABPN1., A de novo PABPN1 germline mutation in a patient with oculopharyngeal muscular dystrophy., In vivo aggregation properties of the nuclear poly(A)-binding protein PABPN1., Transgenic expression of an expanded (GCG)13 repeat PABPN1 leads to weakness and coordination defects in mice., Oculopharyngeal muscular dystrophy with PABPN1 mutation in a Chinese Malaysian woman., Oculopharyngeal muscular dystrophy (OPMD) due to a small duplication in the PABPN1 gene., Oculopharyngeal muscular dystrophy in Hispanic New Mexicans., Oculopharyngeal muscular dystrophy: phenotypic and genotypic studies in a UK population.
PABPN1	2014	20	Congenital central hypoventilation syndrome in Chinese population: Analysis of three new cases and review of the literature., <i>Phox2b</i> mutation mediated by <i>Atoh1</i> expression impaired respiratory rhythm and ventilatory responses to hypoxia and hypercapnia., Generation of two hiPSC lines (UMILi027-A and UMILi028-A) from early and late-onset Congenital Central hypoventilation Syndrome (CCHS) patients carrying a polyalanine expansion mutation in the PHOX2B gene., Genetic study of a patient with congenital central hypoventilation syndrome in Iran: a case report., Congenital central hypoventilation syndrome in neonates: report of fourteen new cases and a review of the literature., Paired-like homeobox gene (PHOX2B) nonpolyalanine repeat expansion mutations (NPARMs): genotype-phenotype correlation in congenital central hypoventilation syndrome (CCHS)., How the Management of Children With Congenital Central Hypoventilation Syndrome Has Changed Over Time: Two Decades of Experience From an Italian Center., A respiratory/Hirschsprung phenotype in a three-generation family associated with a novel pathogenic PHOX2B splice donor mutation., Life-threatening cardiac arrhythmias in congenital central hypoventilation syndrome., Novel PHOX2B mutations in congenital central hypoventilation syndrome., A novel PHOX2B gene mutation in an extremely low birth weight infant with congenital central hypoventilation syndrome and variant Hirschsprung's disease., Carbamazepine Improves Apneic Episodes in Congenital Central Hypoventilation Syndrome (CCHS) With a Novel <i>PHOX2B</i> Exon 1 Missense Mutation., A Case of "Abnormally Abnormal" Hypoxic Ventilatory Responses: A Novel NPARM <i>PHOX 2B</i> Gene Mutation., Significant phenotype variability of congenital central hypoventilation syndrome in a family with polyalanine expansion mutation of the PHOX2B gene., Congenital Central Hypoventilation Syndrome: Neurocognition Already Reduced in Preschool-Aged Children., Oncologic Phenotype of Peripheral Neuroblastic Tumors Associated With PHOX2B Non-Polyalanine Repeat Expansion Mutations., Genotype-phenotype relationship in Japanese patients with congenital central hypoventilation syndrome., Treatment of neuroblastoma in congenital central hypoventilation syndrome with a PHOX2B polyalanine repeat expansion mutation: New twist on a neurocristopathy syndrome., Dysregulation of locus coeruleus development in congenital central hypoventilation syndrome., An unusual cause of fetal hypomobility:congenital central hypoventilation syndrome associated with hirschsprung disease.
PHOX2B	1999	3	A panel study on patients with dominant cerebellar ataxia highlights the frequency of channelopathies., POLG, but not PEO1, is a frequent cause of cerebellar ataxia in Central Europe., Analysis of the trinucleotide CAG repeat from the human mitochondrial DNA polymerase gene in healthy and diseased individuals.
POLG	2011	20	Investigation of RFC1 tandem nucleotide repeat locus in diverse neurodegenerative outcomes in an Indian cohort., Genome-wide identification of tandem repeats associated with splicing variation across 49 tissues in humans., Genetics of Ataxias in Indian Population: A Collative Insight from a Common Genetic Screening Tool., Study of 2D Feature Extraction Techniques for Classification of Spinocerebellar Ataxia Type 12 (SCA12)., Frequency of spinocerebellar ataxia mutations in patients with multiple system atrophy., Investigations of Huntington's Disease and Huntington's Disease-Like Syndromes in Indian Choreatic Patients., Live births following preimplantation genetic testing for dynamic mutation diseases by karyomapping: a report of three cases., Generation of three spinocerebellar ataxia type-12 patients derived induced pluripotent stem cell lines (IGIBi002-A, IGIBi003-A and IGIBi004-A)., Genetic testing for clinically suspected spinocerebellar ataxias: report from a tertiary referral centre in India., Frequency of SCA8, SCA10, SCA12, SCA36, FXTAS and C9orf72 repeat expansions in SCA patients negative for the most common SCA subtypes., Compound heterozygous intermediate MJD alleles cause cerebellar ataxia with sensory neuropathy., Clinical behaviour of spinocerebellar ataxia type 12 and intermediate length abnormal CAG repeats in PPP2R2B., Analysis of SCA8, SCA10, SCA12, SCA17 and SCA19 in patients with unknown spinocerebellar ataxia: a Thai multicentre study., Neuropathology and Cellular Pathogenesis of Spinocerebellar Ataxia Type 12., Mutational screening of 320 Brazilian patients with autosomal dominant spinocerebellar ataxia., Diffusion tensor imaging of spinocerebellar ataxia type 12., Identification of FXTAS presenting with SCA 12 like phenotype in India., Evaluating noncoding nucleotide repeat expansions in amyotrophic lateral sclerosis., Investigation of SCA10 in the Cypriot population: further exclusion of SCA dynamic repeat mutations., Detection of large expansions in SCA8 using a fluorescent repeat-primed PCR assay.
PPP2R2B	2016	20	Genetic screening for Huntington disease phenocopies in Sweden: A tertiary center case series focused on short tandem repeat (STR) disorders., Clinical and Molecular Findings of Intermediate Allele Carriers in the HTT Gene from the Mexican Mestizo Population., Novel Polymorphisms and Genetic Characteristics of the Prion Protein Gene in Pheasants., Genetic landscape of early-onset dementia in Hungary., Prion protein gene mutation detection using long-read Nanopore sequencing., Huntington's disease brain-derived small RNAs recapitulate associated neuropathology in mice., A role of cellular translation regulation associated with toxic Huntingtin protein., Absence of single nucleotide polymorphisms (SNPs) in the open reading frame (ORF) of the prion protein gene (PRNP) in a large sampling of various chicken breeds., Mutation Analysis of the Genes Linked to Early Onset Alzheimer's Disease and Frontotemporal Lobar Degeneration., Neuropathological and genetic characteristics of a post-mortem series of cases with dementia with Lewy bodies clinically suspected of Creutzfeldt-Jakob's disease., Genome-wide analyses as part of the international FTLD-TDP whole-genome sequencing consortium reveals novel disease risk factors and increases support for immune dysfunction in FTLD., Next Generation Sequencing Analysis in Early Onset Dementia Patients., The first report of genetic variations in the chicken prion protein gene., Targeted Genetic Screen in Amyotrophic Lateral Sclerosis Reveals Novel Genetic Variants with Synergistic Effect on Clinical Phenotype., G-quadruplex-binding small molecules ameliorate <i>C9orf72</i> FTD/ALS pathology <i>in&#xa0;vitro</i> and <i>in&#xa0;vivo</i>., Identification of genetic variants associated with Huntington's disease progression: a genome-wide association study., Poly-GP in cerebrospinal fluid links <i>C9orf72</i>-associated dipeptide repeat expression to the asymptomatic phase of ALS/FTD., Antibodies inhibit transmission and aggregation of <i>C9orf72</i> poly-GA dipeptide repeat proteins., Genetic compendium of 1511 human brains available through the UK Medical Research Council Brain Banks Network Resource., Reduced hnRNPA3 increases C9orf72 repeat RNA levels and dipeptide-repeat protein deposition.
PRDM12	2018	4	ATTCT and ATTCC repeat expansions in the ATXN10 gene affect disease penetrance of spinocerebellar ataxia type 10., DNA analysis of benign adult familial myoclonic epilepsy reveals associations between the pathogenic TTTCA repeat insertion in SAMD12 and the nonpathogenic TTTTA repeat expansion in TNRC6A., Intronic (TTTGA)<sub>n</sub> insertion in SAMD12 also causes familial cortical myoclonic tremor with epilepsy., Expansions&#xa0;of&#xa0;intronic TTTCA and TTTTA repeats in benign adult familial myoclonic epilepsy.
PRNP	2022	20	Investigation of RFC1 tandem nucleotide repeat locus in diverse neurodegenerative outcomes in an Indian cohort., Optical Genome Mapping Enables Detection and Accurate Sizing of <i>RFC1</i> Repeat Expansions., CANVAS-related RFC1 mutations in patients with immune-mediated neuropathy., Pathogenic CANVAS-causing but not nonpathogenic RFC1 DNA/RNA repeat motifs form quadruplex or triplex structures., Frequency and phenotypic spectrum of spinocerebellar ataxia 27B and other genetic ataxias in a Spanish cohort of late-onset cerebellar ataxia., Lower Facial Dystonia: An Unexpected Presentation Associated with Pathogenic <i>RFC1</i> Repeat Expansions., Frequency and Phenotype of <i>RFC1</i> Repeat Expansions in Bilateral Vestibulopathy., Normal and pathogenic variation of RFC1 repeat expansions: implications for clinical diagnosis., Intronic <i>FGF14</i> GAA repeat expansions are a common cause of ataxia syndromes with neuropathy and bilateral vestibulopathy., Birth of monozygotic dichorionic twins after a single blastocyst embryo transfer: a case report of genetic determination of zygosity., GAA-FGF14 ataxia (SCA27B): phenotypic profile, natural history progression and 4-aminopyridine treatment response., RFC1 repeat expansions and cerebellar ataxia, neuropathy and vestibular areflexia syndrome: Experience and perspectives from a neuromuscular disorders unit., Association of biallelic RFC1 expansion with early-onset Parkinson's disease., Proteomic profile of nuclei containing p62-positive inclusions in a patient with neuronal intranuclear inclusion disease., Cognitive Impairment in a Complex Family With AAGGG and ACAGG Repeat Expansions in RFC1 Detected by ExpansionHunter Denovo., Truncating Variants in <i>RFC1</i> in Cerebellar Ataxia, Neuropathy, and Vestibular Areflexia Syndrome., New Cerebellar Ataxia, Neuropathy, Vestibular Areflexia Syndrome cases are caused by the presence of a nonsense variant in compound heterozygosity with the pathogenic repeat expansion in the RFC1 gene., Parallel in-depth analysis of repeat expansions in ataxia patients by long-read sequencing., Complete Mitochondrial Genome Sequences of Korean Phytophthora infestans Isolates and Comparative Analysis of Mitochondrial Haplotypes., Cognitive impairment is not uncommon in patients with biallelic RFC1 AAGGG repeat expansion, but the expansion is rare in patients with cognitive disease.
RAPGEF2	2022	4	Non-coding CGG repeat expansion in <i>LOC642361/NUTM2B-AS1</i> is associated with a phenotype of oculopharyngodistal myopathy., A large pedigree study confirmed the CGG repeat expansion of RILPL1 Is associated with oculopharyngodistal myopathy., GGC Repeat Expansion of RILPL1 is Associated with Oculopharyngodistal Myopathy., The CGG repeat expansion in RILPL1 is associated with oculopharyngodistal myopathy type 4.
RFC1	2011	6	Effects of G-CSF on hPDLSC proliferation and osteogenic differentiation in the LPS-induced inflammatory microenvironment., Unblending of Transcriptional Condensates in Human Repeat Expansion Disease., Teenage-onset progressive myoclonic epilepsy due to a familial <i>C9orf72</i> repeat expansion., Interaction of IL1B and IL1RN polymorphisms, smoking habit, gender, and ethnicity with aggressive and chronic periodontitis susceptibility., Runx2 contributes to murine Col10a1 gene regulation through direct interaction with its cis-enhancer., Quantitatively different red cell/nucleated cell chimerism in patients with long-term, persistent hematopoietic mixed chimerism after bone marrow transplantation for thalassemia major or sickle cell disease.
RILPL1	2018	16	Complete SAMD12 repeat expansion sequencing in a four-generation BAFME1 family with anticipation., A novel FAME1 repeat configuration in a European family identified using a combined genomics approach., Insights into familial adult myoclonus epilepsy pathogenesis: How the same repeat expansion in six unrelated genes may lead to cortical excitability., ATTCT and ATTCC repeat expansions in the ATXN10 gene affect disease penetrance of spinocerebellar ataxia type 10., Complete sequencing of expanded SAMD12 repeats by long-read sequencing and Cas9-mediated enrichment., Comprehensive genetic, clinical and electrophysiological studies of familial cortical myoclonic tremor with epilepsy 1 highlight the role of gene configurations., Clinical and genomic analysis of a large Chinese family with familial cortical myoclonic tremor with epilepsy and <i>SAMD12</i> intronic repeat expansion., Genomic analysis of patients in a South Indian Community with autosomal dominant cortical tremor, myoclonus and epilepsy suggests a founder repeat expansion mutation in the <i>SAMD12</i> gene., DNA analysis of benign adult familial myoclonic epilepsy reveals associations between the pathogenic TTTCA repeat insertion in SAMD12 and the nonpathogenic TTTTA repeat expansion in TNRC6A., Founder effect of the TTTCA repeat insertions in SAMD12 causing BAFME1., TTTCA Repeat Expansion of <i>SAMD12</i> in a New Benign Adult Familial Myoclonic Epilepsy Pedigree., Unstable TTTTA/TTTCA expansions in MARCH6 are associated with Familial Adult Myoclonic Epilepsy type 3., Intronic (TTTGA)<sub>n</sub> insertion in SAMD12 also causes familial cortical myoclonic tremor with epilepsy., Detecting a long insertion variant in SAMD12 by SMRT sequencing: implications of long-read whole-genome sequencing for repeat expansion diseases., Long-read sequencing identified intronic repeat expansions in <i>SAMD12</i> from Chinese pedigrees affected with familial cortical myoclonic tremor with epilepsy., Expansions&#xa0;of&#xa0;intronic TTTCA and TTTTA repeats in benign adult familial myoclonic epilepsy.
RUNX2	2011	3	Periodically programmed building and collapse of DNA networks enables an ultrahigh signal amplification effect for ultrasensitive nucleic acids analysis., PIPEMicroDB: microsatellite database and primer generation tool for pigeonpea genome., RiDs db: Repeats in diseases database.
SAMD12	2019	2	DNA analysis of benign adult familial myoclonic epilepsy reveals associations between the pathogenic TTTCA repeat insertion in SAMD12 and the nonpathogenic TTTTA repeat expansion in TNRC6A., Intronic ATTTC repeat expansions in STARD7 in familial adult myoclonic epilepsy linked to chromosome 2.
