Gene	Earliest_Pub_Date	NumPub	Titles
ATXN3	2023	20	Establishment of human-induced pluripotent stem cell GZHMCi0011-A from peripheral blood mononuclear cells from a volunteer with 14/63 CAG repeats of the ATXN3 mutation., Prevalence of repeat expansions causing autosomal dominant spinocerebellar ataxias in Hokkaido, the northernmost island of Japan., Mitochondrial Dysfunction and Decreased Cytochrome <i>c</i> in Cell and Animal Models of Machado-Joseph Disease., Antagonistic roles of canonical and Alternative-RPA in disease-associated tandem CAG repeat instability., Development of an isogenic human cell trio that models polyglutamine disease., Repeat expansions in <i>NOP56</i> are a cause of spinocerebellar ataxia Type 36 in the British population., Widespread alternative splicing dysregulation occurs presymptomatically in CAG expansion spinocerebellar ataxias., The molecular mechanisms of spinocerebellar ataxias for DNA repeat expansion in disease., Frequency and phenotypic spectrum of spinocerebellar ataxia 27B and other genetic ataxias in a Spanish cohort of late-onset cerebellar ataxia., The genetic and clinical spectrum in a cohort of 39 families with complex inherited peripheral neuropathies., Extreme phenotypic heterogeneity in non-expansion spinocerebellar ataxias., First families with spinocerebellar ataxia type 7 in Poland., GAA-FGF14 ataxia (SCA27B): phenotypic profile, natural history progression and 4-aminopyridine treatment response., CAG Repeat Expansion in THAP11 Is Associated with a Novel Spinocerebellar Ataxia., Short tandem repeat expansions in sporadic amyotrophic lateral sclerosis and frontotemporal dementia., A Chinese SCA36 pedigree analysis of <i>NOP56</i> expansion region based on long-read sequencing., Pentanucleotide repeat-related disorders: Genetics and bioinformatic discovery and detection., TR-FRET-Based Immunoassay to Measure Ataxin-2 as a Target Engagement Marker in Spinocerebellar Ataxia Type 2., Neuropathology of spinocerebellar ataxia type 8: Common features and unique tauopathy., Repeat-associated non-AUG translation induces cytoplasmic aggregation of CAG repeat-containing RNAs.
ATXN7	2010	20	The Frequency of Intermediate Alleles in Patients with Cerebellar Phenotypes., Prevalence of repeat expansions causing autosomal dominant spinocerebellar ataxias in Hokkaido, the northernmost island of Japan., Short tandem repeat expansions in sporadic amyotrophic lateral sclerosis and frontotemporal dementia., Neuropathology of spinocerebellar ataxia type 8: Common features and unique tauopathy., CCG&#x2022;CGG interruptions in high-penetrance SCA8 families increase RAN translation and protein toxicity., Genome sequencing identifies rare tandem repeat expansions and copy number variants in Lennox-Gastaut syndrome., Genome sequencing broadens the range of contributing variants with clinical implications in schizophrenia., Frequency of spinocerebellar ataxia mutations in patients with multiple system atrophy., Genetic and clinical analyses of spinocerebellar ataxia type 8 in mainland China., Noncoding repeat expansions for ALS in Japan are associated with the <i>ATXN8OS</i> gene., PSP-Phenotype in SCA8: Case Report and Systemic Review., Frequency of SCA8, SCA10, SCA12, SCA36, FXTAS and C9orf72 repeat expansions in SCA patients negative for the most common SCA subtypes., Sequence configuration of spinocerebellar ataxia type 8 repeat expansions in a Japanese cohort of 797 ataxia subjects., Analysis of a fully penetrant spinocerebellar ataxia type 8 Brazilian family., Compound heterozygous intermediate MJD alleles cause cerebellar ataxia with sensory neuropathy., Analysis of SCA8, SCA10, SCA12, SCA17 and SCA19 in patients with unknown spinocerebellar ataxia: a Thai multicentre study., Mutational screening of 320 Brazilian patients with autosomal dominant spinocerebellar ataxia., Investigation of SCA10 in the Cypriot population: further exclusion of SCA dynamic repeat mutations., Detection of large expansions in SCA8 using a fluorescent repeat-primed PCR assay., Coexisting huntingtin and SCA8 repeat expansion: case report of a severe complex neurodegenerative syndrome.
ATXN8OS	2014	9	Prevalence of repeat expansions causing autosomal dominant spinocerebellar ataxias in Hokkaido, the northernmost island of Japan., Synthesis and cloning of long repeat sequences using single-stranded circular DNA., ATTCT and ATTCC repeat expansions in the ATXN10 gene affect disease penetrance of spinocerebellar ataxia type 10., Midbrain atrophy related to parkinsonism in a non-coding repeat expansion disorder: five cases of spinocerebellar ataxia type 31 with nigrostriatal dopaminergic dysfunction., Small molecule targeting r(UGGAA)<sub>n</sub> disrupts RNA foci and alleviates disease phenotype in Drosophila model., Long-read sequencing identifies the pathogenic nucleotide repeat expansion in RFC1 in a Japanese case of CANVAS., Sequence configuration of spinocerebellar ataxia type 8 repeat expansions in a Japanese cohort of 797 ataxia subjects., Regulatory Role of RNA Chaperone TDP-43 for RNA Misfolding and Repeat-Associated Translation in SCA31., Rapid detection of expanded short tandem repeats in personal genomics using hybrid sequencing.
BEAN1	2023	20	Unveiling the SOD1-mediated ALS phenotype: insights from a comprehensive meta-analysis., Glycine-Alanine Dipeptide Repeat Protein from C9-ALS Interacts with Sulfide Quinone Oxidoreductase (SQOR) to Induce the Activity of the NLRP3 Inflammasome in HMC3 Microglia: Irisflorentin Reverses This Interaction., Roadmap for C9ORF72 in Frontotemporal Dementia and Amyotrophic Lateral Sclerosis: Report on the C9ORF72 FTD/ALS Summit., Senataxin helicase, the causal gene defect in ALS4, is a significant modifier of C9orf72 ALS G4C2 and arginine-containing dipeptide repeat toxicity., C9orf72 Repeat Expansion Initially Presenting as Late-onset Bipolar Disorder With Psychosis., Temporal course of cognitive and behavioural changes in motor neuron diseases., Amyotrophic Lateral Sclerosis: From Mechanisms to Current, Emerging, and Alternative Therapeutics., C9orf72-ALS human iPSC microglia are pro-inflammatory and toxic to co-cultured motor neurons via MMP9., Divergent single cell transcriptome and epigenome alterations in ALS and FTD patients with C9orf72 mutation., Insight into Tetramolecular DNA G-Quadruplexes Associated with ALS and FTLD: Cation Interactions and Formation of Higher-Ordered Structure., Familial motor neuron disease: co-occurrence of PLS and ALS (-FTD)., Translation of dipeptide repeat proteins in <i>C9ORF72</i> ALS/FTD through unique and redundant AUG initiation codons., Pearls &amp; Oy-sters: Familial Verbal Auditory Agnosia Due to C9orf72 Repeat Expansion., The C9ORF72 repeat expansion alters neurodevelopment., Psychopharmacological Medication Use in Frontotemporal Dementia at the Time of Diagnosis: Comparison with Alzheimer's Disease., Genetic and Neuroimaging Analysis of SIGMAR1 for Frontotemporal Dementia., Repeated mild traumatic brain injury triggers pathology in asymptomatic C9ORF72 transgenic mice., No Association of Multiple Sclerosis with <i>C9orf72</i> Hexanucleotide Repeat Size in an Austrian Cohort., FUS regulates RAN translation through modulating the G-quadruplex structure of GGGGCC repeat RNA in <i>C9orf72</i>-linked ALS/FTD., Distinct neuroinflammatory signatures exist across genetic and sporadic amyotrophic lateral sclerosis cohorts.
C9orf72	2017	20	Prevalence of repeat expansions causing autosomal dominant spinocerebellar ataxias in Hokkaido, the northernmost island of Japan., Genome-wide identification of tandem repeats associated with splicing variation across 49 tissues in humans., Extreme phenotypic heterogeneity in non-expansion spinocerebellar ataxias., Genetics of Ataxias in Indian Population: A Collative Insight from a Common Genetic Screening Tool., Fast and reliable detection of repeat expansions in spinocerebellar ataxia using exomes., The S-Factor, a New Measure of Disease Severity in Spinocerebellar Ataxia: Findings and Implications., Whole genome sequencing for the diagnosis of neurological repeat expansion disorders in the UK: a retrospective diagnostic accuracy and prospective clinical validation study., Genetic Distribution of Five Spinocerebellar Ataxia Microsatellite Loci in Mexican Native American Populations and Its Impact on Contemporary Mestizo Populations., Novel CACNA1A Variant p.Cys256Phe Disrupts Disulfide Bonds and Causes Spinocerebellar Ataxia., Comprehensive transcriptome-wide analysis of spliceopathy correction of myotonic dystrophy using CRISPR-Cas9 in iPSCs-derived cardiomyocytes., Molecular spectrum, family screening and genetic counselling of Spinocerebellar Ataxia (SCA) cases in an Indian scenario., Frequency of spinocerebellar ataxia mutations in patients with multiple system atrophy., Progressive Ataxia with Hemiplegic Migraines: a Phenotype of CACNA1A Missense Mutations, Not CAG Repeat Expansions., Repeat variations in polyglutamine disease-associated genes and cognitive function in old age., Analysis of CACNA1A CAG repeat lengths in patients with familial&#xa0;ALS., High Degree of Genetic Heterogeneity for Hereditary Cerebellar Ataxias in Australia., Long-term evolution of patient-reported outcome measures in spinocerebellar ataxias., Frequency of SCA8, SCA10, SCA12, SCA36, FXTAS and C9orf72 repeat expansions in SCA patients negative for the most common SCA subtypes., Co-expression Patterns between <i>ATN1</i> and <i>ATXN2</i> Coincide with Brain Regions Affected in Huntington's Disease., Sequence configuration of spinocerebellar ataxia type 8 repeat expansions in a Japanese cohort of 797 ataxia subjects.
CACNA1A	2023	20	Molecular typing of Mycoplasma pneumoniae and its correlation with macrolide resistance in children in Henan of China., Non-coding CGG repeat expansion in <i>LOC642361/NUTM2B-AS1</i> is associated with a phenotype of oculopharyngodistal myopathy., EXPRESS: FAMILIES WITH NON-HODGKIN LYMPHOMA AND PLASMA CELL DYSCRASIAS IN THEIR PEDIGREES., A large pedigree study confirmed the CGG repeat expansion of RILPL1 Is associated with oculopharyngodistal myopathy., Prevalence of repeat expansions causing autosomal dominant spinocerebellar ataxias in Hokkaido, the northernmost island of Japan., Memantine administration prevented chorea movement in Huntington's disease: a case report., Temporal course of cognitive and behavioural changes in motor neuron diseases., Genomic architecture of autism spectrum disorder in Qatar: The BARAKA-Qatar Study., Amyotrophic Lateral Sclerosis: From Mechanisms to Current, Emerging, and Alternative Therapeutics., Congenital central hypoventilation syndrome in Chinese population: Analysis of three new cases and review of the literature., Molecular characterization of MRSA collected during national surveillance between 2008 and 2019 in the Netherlands., Novel genetic variant associated with globoid cell leukodystrophy in a family of mixed breed dogs., FUS regulates RAN translation through modulating the G-quadruplex structure of GGGGCC repeat RNA in <i>C9orf72</i>-linked ALS/FTD., Frequency and Phenotype of <i>RFC1</i> Repeat Expansions in Bilateral Vestibulopathy., Robust and protective immune responses induced by heterologous prime-boost vaccination with DNA-protein dimeric RBD vaccines for COVID-19., Phenotypical differences of <i>C9ORF72</i> gene-positive and negative amyotrophic lateral sclerosis: a comparative case series., Comprehensive de novo mutation discovery with HiFi long-read sequencing., Cord Blood Hematological Parameters of Fetuses Detected Different Thalassemia Genotypes in the Second Trimester of Pregnancy., NOTCH2NLC GGC repeat expansion causes retinal pathology with intranuclear inclusions throughout the retina and causes visual impairment., Novel, heterozygous, de novo pathogenic variant (c.4963delA: p.Thr1656Glnfs*42) of the NF1 gene in a Chinese family with neurofibromatosis type 1.
COMP	2000	20	Short- and long-interval intracortical inhibition in EPM1 is related to genotype., Insights into the Genetic Profile of Two Siblings Affected by Unverricht-Lundborg Disease Using Patient-Derived hiPSCs., Clinical and molecular characterization of Unverricht-Lundborg disease among Egyptian patients., Genetic testing and the phenotype of Polish patients with Unverricht-Lundborg disease (EPM1) - A cohort study., Teenage-onset progressive myoclonic epilepsy due to a familial <i>C9orf72</i> repeat expansion., No evidence of a role for cystatin B gene in juvenile myoclonic epilepsy., A shared haplotype indicates a founder event in Unverricht-Lundborg disease patients from Serbia., Severer phenotype in Unverricht-Lundborg disease (EPM1) patients compound heterozygous for the dodecamer repeat expansion and the c.202C&gt;T mutation in the CSTB gene., Primary motor cortex alterations in a compound heterozygous form of Unverricht-Lundborg disease (EPM1)., Unverricht-Lundborg progressive myoclonus epilepsy in Oman., Cystatin B: mutation detection, alternative splicing and expression in progressive myclonus epilepsy of Unverricht-Lundborg type (EPM1) patients., Polymerase chain reaction-based analysis using deaminated DNA of dodecamer expansions in CSTB, associated with Unverricht-Lundborg myoclonus epilepsy., DNA deamination enables direct PCR amplification of the cystatin B (CSTB) gene-associated dodecamer repeat expansion in myoclonus epilepsy type Unverricht-Lundborg., FOunder effect in patients with Unverricht-Lundborg disease on reunion island., Haplotype study of West European and North African Unverricht-Lundborg chromosomes: evidence for a few founder mutations., Unverricht-Lundborg disease in a five-generation Arab family: instability of dodecamer repeats., Juvenile Huntington's disease presenting as progressive myoclonic epilepsy., Tetraplex formation by the progressive myoclonus epilepsy type-1 repeat: implications for instability in the repeat expansion diseases., A patient with 2 different repeat expansion mutations., Characterization of the cystatin B gene promoter harboring the dodecamer repeat expanded in progressive myoclonus epilepsy, EPM1.
CSTB	2017	6	Insights into familial adult myoclonus epilepsy pathogenesis: How the same repeat expansion in six unrelated genes may lead to cortical excitability., Familial Cerebellar Ataxia and Amyotrophic Lateral Sclerosis/Frontotemporal Dementia with DAB1 and C9ORF72 Repeat Expansions: An 18-Year Study., ATTCT and ATTCC repeat expansions in the ATXN10 gene affect disease penetrance of spinocerebellar ataxia type 10., Prevalence of <i>RFC1</i>-mediated spinocerebellar ataxia in a North American ataxia cohort., Mutational mechanism for DAB1 (ATTTC)<sub>n</sub> insertion in SCA37: ATTTT repeat lengthening and nucleotide substitution., A Pentanucleotide ATTTC Repeat Insertion in the Non-coding Region of DAB1, Mapping to SCA37, Causes Spinocerebellar Ataxia.
DAB1	2007	5	Unravelling the link between neurodevelopmental disorders and short tandem CGG-repeat expansions., Direct haplotype-resolved 5-base HiFi sequencing for genome-wide profiling of hypermethylation outliers in a rare disease cohort., Transcriptome and Genome Analysis Uncovers a <i>DMD</i> Structural Variant: A Case Report., Genome sequencing identifies rare tandem repeat expansions and copy number variants in Lennox-Gastaut syndrome., CGG-repeat expansion in the DIP2B gene is associated with the fragile site FRA12A on chromosome 12q13.1.
DIP2B	2010	20	Clinical interpretation of cell-based non-invasive prenatal testing for monogenic disorders including repeat expansion disorders: potentials and pitfalls., Clinical application of next generation sequencing-based haplotype linkage analysis in the preimplantation genetic testing for germline mosaicisms., Transcriptome and Genome Analysis Uncovers a <i>DMD</i> Structural Variant: A Case Report., RNA-seq analysis, targeted long-read sequencing and in silico prediction to unravel pathogenic intronic events and complicated splicing abnormalities in dystrophinopathy., Comprehensive transcriptome-wide analysis of spliceopathy correction of myotonic dystrophy using CRISPR-Cas9 in iPSCs-derived cardiomyocytes., DMD/BMD prenatal diagnosis and treatment expectation in a single centre in China for 15&#xa0;years., High throughput screening for expanded CTG repeats in myotonic dystrophy type 1 using melt curve analysis., Transplantation of Dystrophin Expressing Chimeric Human Cells of Myoblast/Mesenchymal Stem Cell Origin Improves Function in Duchenne Muscular Dystrophy Model., CRISPR-cas gene-editing as plausible treatment of neuromuscular and nucleotide-repeat-expansion diseases: A systematic review., Performance comparison of two whole genome amplification techniques in frame of multifactor preimplantation genetic testing., Single amino acid loss in the dystrophin protein associated with a mild clinical phenotype., Serum Levels of MicroRNA-206 and Novel Mini-STR Assays for Carrier Detection in Duchenne Muscular Dystrophy., A rare form of limb girdle muscular dystrophy (type 2E) seen in an Iranian family detected by autozygosity mapping., Molecular diagnosis of dystrophinopathies using a multi-technique analysis algorithm., Ataxin-3 protein modification as a treatment strategy for spinocerebellar ataxia type 3: removal of the CAG containing exon., A family with fragile X syndrome, Duchenne muscular dystrophy and ichthyosis transmitted by an asymptomatic carrier., Computational study of the human dystrophin repeats: interaction properties and molecular dynamics., Prenatal diagnosis of Duchenne/Becker muscular dystrophy by short tandem repeat segregation analysis in Argentine families., Comparison of serum creatine kinase estimation with short tandem repeats based linkage analysis in carriers and affected children of Duchenne muscular dystrophy., Association of interleukin-1 beta (-511C/T) polymorphisms with osteoporosis in postmenopausal women.
DMD	2022	20	Clinical interpretation of cell-based non-invasive prenatal testing for monogenic disorders including repeat expansion disorders: potentials and pitfalls., Msi2 enhances muscle dysfunction in a myotonic dystrophy type 1 mouse model., Peptide-conjugated antimiRs improve myotonic dystrophy type 1 phenotypes by promoting endogenous MBNL1 expression., Characterization of theory of mind performance in patients with myotonic dystrophy type 1., Resistance Exercise Training Rescues Mitochondrial Dysfunction in Skeletal Muscle of Patients with Myotonic Dystrophy Type 1., Transcriptome-Wide Studies of RNA-Targeted Small Molecules Provide a Simple and Selective r(CUG)<sup>exp</sup> Degrader in Myotonic Dystrophy., <i>In Cis</i> Effect of <i>DMPK</i> Expanded Alleles in Myotonic Dystrophy Type 1 Patients Carrying Variant Repeats at 5' and 3' Ends of the CTG Array., Lymphoblastoid cell lines derived from iPSCs of a myotonic dystrophy type 1 patient carrying 700 CTG repeats (CBRCULi007-A) and a control (CBRCULi006-A)., Direct haplotype-resolved 5-base HiFi sequencing for genome-wide profiling of hypermethylation outliers in a rare disease cohort., Association of Copresence of Pathogenic Variants Related to Amyotrophic Lateral Sclerosis and Prognosis., Dysregulation of DNA repair genes in Fuchs endothelial corneal dystrophy., Short tandem repeat expansions in sporadic amyotrophic lateral sclerosis and frontotemporal dementia., Choroid plexus mis-splicing and altered cerebrospinal fluid composition in myotonic dystrophy type 1., Periostin as a blood biomarker of muscle cell fibrosis, cardiomyopathy and disease severity in myotonic dystrophy type 1., Frequency and type of cancers in myotonic dystrophy: A retrospective cross-sectional study., Generation of four myotonic dystrophy type 1 patient iPSC lines (CBRCULi002-A, CBRCULi003-A, CBRCULi004-A, CBRCULi005-A) and a control (CBRCULi001-A) derived from lymphoblastoids cell lines., The Genomic landscape of short tandem repeats across multiple ancestries., Quantitative magnetic resonance imaging assessment of muscle composition in myotonic dystrophy mice., Comprehensive evaluation of human-derived anti-poly-GA antibodies in cellular and animal models of <i>C9orf72</i> disease., Study of an RNA-Focused DNA-Encoded Library Informs Design of a Degrader of a r(CUG) Repeat Expansion.
DMPK	2017	2	RAN translation at C9orf72-associated repeat expansions is selectively enhanced by the integrated stress response., Richieri-Costa-Pereira syndrome: Expanding its phenotypic and genotypic spectrum.
EIF4A3	2004	12	Clinical variability associated with intronic FGF14 GAA repeat expansion in Japan., Frequency of GAA-<i>FGF14</i> Ataxia in a Large Cohort of Brazilian Patients With Unsolved Adult-Onset Cerebellar Ataxia., Frequency and phenotypic spectrum of spinocerebellar ataxia 27B and other genetic ataxias in a Spanish cohort of late-onset cerebellar ataxia., Intronic <i>FGF14</i> GAA repeat expansions are a common cause of ataxia syndromes with neuropathy and bilateral vestibulopathy., GAA-FGF14 ataxia (SCA27B): phenotypic profile, natural history progression and 4-aminopyridine treatment response., Deep Intronic <i>FGF14</i> GAA Repeat Expansion in Late-Onset Cerebellar Ataxia., An intronic GAA repeat expansion in FGF14 causes the autosomal-dominant adult-onset ataxia SCA50/ATX-FGF14., Genome-wide detection of tandem DNA repeats that are expanded in autism., A panel study on patients with dominant cerebellar ataxia highlights the frequency of channelopathies., Spinocerebellar ataxia 28: a novel AFG3L2 mutation in a German family with young onset, slow progression and saccadic slowing., Mutation analysis in the fibroblast growth factor 14 gene: frameshift mutation and polymorphisms in patients with inherited ataxias., Molecular genetics of hereditary spinocerebellar ataxia: mutation analysis of spinocerebellar ataxia genes and CAG/CTG repeat expansion detection in 225 Italian families.
FGF14	2022	20	Tau reduction attenuates autism-like features in Fmr1 knockout mice., The Frequency of Intermediate Alleles in Patients with Cerebellar Phenotypes., Trehalose consumption ameliorates pathogenesis in an inducible mouse model of the Fragile X-associated tremor/ataxia syndrome., Unravelling the link between neurodevelopmental disorders and short tandem CGG-repeat expansions., Large-Scale Whole Genome Sequence Analysis of &gt;22,000 Subjects Provides no Evidence of <i>FMR1</i> Premutation Allele Involvement in Autism Spectrum Disorder., Evaluation of the role of <i>FMR1</i> CGG repeat allele in Parkinson's disease from the Chinese population., Cochlear Nucleus Transcriptome of a Fragile X Mouse Model Reveals Candidate Genes for Hyperacusis., Accelerated Apoptosis and Down-Regulated FMRP in Human Neuroblastoma Cells with CRISPR/<i>Cas9</i> Genome Editing., A Postmortem MRI Study of Cerebrovascular Disease and Iron Content at End-Stage of Fragile X-Associated Tremor/Ataxia Syndrome., Size matters: Fighting repeat expansion size in fragile X syndrome using antisense oligonucleotides., Dissecting the roles of EIF4G homologs reveals DAP5 as a modifier of CGG repeat-associated toxicity in a Drosophila model of FXTAS., Site-specific R-loops induce CGG repeat contraction and fragile X gene reactivation., Short tandem repeat expansions in sporadic amyotrophic lateral sclerosis and frontotemporal dementia., Synthesis and cloning of long repeat sequences using single-stranded circular DNA., A sensitive and reproducible qRT-PCR assay detects physiological relevant trace levels of FMR1 mRNA in individuals with Fragile X syndrome., Neuropsychiatric feature-based subgrouping reveals neural sensory processing spectrum in female FMR1 premutation carriers: A pilot study., The mutational dynamics of short tandem repeats in large, multigenerational families., Non-Mendelian inheritance patterns and extreme deviation rates of CGG repeats in autism., Parallel in-depth analysis of repeat expansions in ataxia patients by long-read sequencing., Screening for Fragile X Syndrome Among Filipino Children with Autism Spectrum Disorder.
FMR1	1995	1	Definition of the blepharophimosis, ptosis, epicanthus inversus syndrome critical region at chromosome 3q23 based on the analysis of chromosomal anomalies.
